{
  "$schema": "https://json-schema.org/draft/2020-12/schema",
  "$id": "https://kaizen-agents.org/schemas/builder-agent/kaizen-loop-payload.schema.json",
  "title": "KaizenLoopPayload",
  "type": "object",
  "additionalProperties": false,
  "required": [
    "status",
    "summary",
    "notes"
  ],
  "allOf": [
    {
      "if": {
        "required": ["status"],
        "properties": {
          "status": {
            "const": "blocked"
          }
        }
      },
      "then": {
        "required": ["blockedReason"],
        "properties": {
          "blockedReason": {
            "minLength": 1,
            "pattern": "\\S"
          }
        }
      }
    },
    {
      "if": {
        "required": ["status"],
        "properties": {
          "status": {
            "const": "fixed"
          }
        }
      },
      "then": {
        "properties": {
          "notes": {
            "minLength": 1,
            "pattern": "\\S",
            "not": {
              "pattern": "(?:^|[\\s.;])(?:(?:[-*+]|\\d+[.)])\\s+)?(?:\\*\\*)?(Verification|Residual risk)\\s*:(?:\\*\\*)?[\\s\\S]*(?:^|[\\s.;])(?:(?:[-*+]|\\d+[.)])\\s+)?(?:\\*\\*)?\\1\\s*:(?:\\*\\*)?"
            },
            "allOf": [
              {
                "pattern": "(?:^|[\\s.;])(?:(?:[-*+]|\\d+[.)])\\s+)?(?:Verification\\s*:|\\*\\*Verification\\s*:\\*\\*)(?=(?:(?!(?:^|[\\s.;])(?:(?:[-*+]|\\d+[.)])\\s+)?(?:(?:Verification|Residual risk)\\s*:|\\*\\*(?:Verification|Residual risk)\\s*:\\*\\*))[\\s\\S])*?[^\\s.;,:—–\\-_*+|#>])"
              },
              {
                "pattern": "(?:^|[\\s.;])(?:(?:[-*+]|\\d+[.)])\\s+)?(?:Residual risk\\s*:|\\*\\*Residual risk\\s*:\\*\\*)(?=(?:(?!(?:^|[\\s.;])(?:(?:[-*+]|\\d+[.)])\\s+)?(?:(?:Verification|Residual risk)\\s*:|\\*\\*(?:Verification|Residual risk)\\s*:\\*\\*))[\\s\\S])*?[^\\s.;,:—–\\-_*+|#>])"
              }
            ]
          }
        }
      }
    },
    {
      "if": {
        "required": ["status"],
        "properties": {
          "status": {
            "enum": ["fixed", "partial"]
          }
        }
      },
      "then": {
        "properties": {
          "blockedReason": {
            "not": {
              "pattern": "\\S"
            }
          }
        }
      }
    },
    {
      "if": {
        "required": ["status"],
        "properties": {
          "status": {
            "const": "partial"
          }
        }
      },
      "then": {
        "properties": {
          "notes": {
            "minLength": 1,
            "pattern": "\\S",
            "not": {
              "pattern": "(?:^|[\\s.;])(?:(?:[-*+]|\\d+[.)])\\s+)?(?:\\*\\*)?(Completed scope|Incomplete scope|Verification|Residual risk)\\s*:(?:\\*\\*)?[\\s\\S]*(?:^|[\\s.;])(?:(?:[-*+]|\\d+[.)])\\s+)?(?:\\*\\*)?\\1\\s*:(?:\\*\\*)?"
            },
            "allOf": [
              {
                "pattern": "(?:^|[\\s.;])(?:(?:[-*+]|\\d+[.)])\\s+)?(?:Completed scope\\s*:|\\*\\*Completed scope\\s*:\\*\\*)(?=(?:(?!(?:^|[\\s.;])(?:(?:[-*+]|\\d+[.)])\\s+)?(?:(?:Completed scope|Incomplete scope|Verification|Residual risk)\\s*:|\\*\\*(?:Completed scope|Incomplete scope|Verification|Residual risk)\\s*:\\*\\*))[\\s\\S])*?[^\\s.;,:—–\\-_*+|#>])"
              },
              {
                "pattern": "(?:^|[\\s.;])(?:(?:[-*+]|\\d+[.)])\\s+)?(?:Incomplete scope\\s*:|\\*\\*Incomplete scope\\s*:\\*\\*)(?=(?:(?!(?:^|[\\s.;])(?:(?:[-*+]|\\d+[.)])\\s+)?(?:(?:Completed scope|Incomplete scope|Verification|Residual risk)\\s*:|\\*\\*(?:Completed scope|Incomplete scope|Verification|Residual risk)\\s*:\\*\\*))[\\s\\S])*?[^\\s.;,:—–\\-_*+|#>])"
              },
              {
                "pattern": "(?:^|[\\s.;])(?:(?:[-*+]|\\d+[.)])\\s+)?(?:Verification\\s*:|\\*\\*Verification\\s*:\\*\\*)(?=(?:(?!(?:^|[\\s.;])(?:(?:[-*+]|\\d+[.)])\\s+)?(?:(?:Completed scope|Incomplete scope|Verification|Residual risk)\\s*:|\\*\\*(?:Completed scope|Incomplete scope|Verification|Residual risk)\\s*:\\*\\*))[\\s\\S])*?[^\\s.;,:—–\\-_*+|#>])"
              },
              {
                "pattern": "(?:^|[\\s.;])(?:(?:[-*+]|\\d+[.)])\\s+)?(?:Residual risk\\s*:|\\*\\*Residual risk\\s*:\\*\\*)(?=(?:(?!(?:^|[\\s.;])(?:(?:[-*+]|\\d+[.)])\\s+)?(?:(?:Completed scope|Incomplete scope|Verification|Residual risk)\\s*:|\\*\\*(?:Completed scope|Incomplete scope|Verification|Residual risk)\\s*:\\*\\*))[\\s\\S])*?[^\\s.;,:—–\\-_*+|#>])"
              },
              {
                "if": {
                  "pattern": "(?:^|[\\s.;])(?:(?:[-*+]|\\d+[.)])\\s+)?(?:Verification\\s*:|\\*\\*Verification\\s*:\\*\\*)\\s*(?:[sS][kK][iI][pP][pP][eE][dD]|\\*\\*[sS][kK][iI][pP][pP][eE][dD]\\*\\*|__[sS][kK][iI][pP][pP][eE][dD]__|\\*[sS][kK][iI][pP][pP][eE][dD]\\*|_[sS][kK][iI][pP][pP][eE][dD]_|`[sS][kK][iI][pP][pP][eE][dD]`)(?=$|[\\s.;,:—–-])"
                },
                "then": {
                  "pattern": "(?:^|[\\s.;])(?:(?:[-*+]|\\d+[.)])\\s+)?(?:Verification\\s*:|\\*\\*Verification\\s*:\\*\\*)\\s*(?:[sS][kK][iI][pP][pP][eE][dD]|\\*\\*[sS][kK][iI][pP][pP][eE][dD]\\*\\*|__[sS][kK][iI][pP][pP][eE][dD]__|\\*[sS][kK][iI][pP][pP][eE][dD]\\*|_[sS][kK][iI][pP][pP][eE][dD]_|`[sS][kK][iI][pP][pP][eE][dD]`)[ \\t]*[—–-](?![ \\t]*(?:(?:Completed scope|Incomplete scope|Verification|Residual risk)\\s*:|\\*\\*(?:Completed scope|Incomplete scope|Verification|Residual risk)\\s*:\\*\\*))[ \\t]*(?=(?:(?!(?:^|[\\s.;])(?:(?:[-*+]|\\d+[.)])\\s+)?(?:(?:Completed scope|Incomplete scope|Verification|Residual risk)\\s*:|\\*\\*(?:Completed scope|Incomplete scope|Verification|Residual risk)\\s*:\\*\\*))[\\s\\S])*?[^\\s.;,:—–\\-_*+|#>])"
                }
              }
            ]
          }
        }
      }
    },
    {
      "if": {
        "required": ["status"],
        "properties": {
          "status": {
            "enum": ["fixed", "partial"]
          }
        }
      },
      "then": {
        "not": {
          "required": ["humanRequest"]
        }
      }
    }
  ],
  "properties": {
    "status": {
      "type": "string",
      "enum": ["fixed", "partial", "blocked"],
      "description": "Result status consumed by kaizen-loop. Use fixed when the scoped implementation is complete, partial when reviewable code was produced but known non-blocking work remains for verifier or human review, and blocked when the builder cannot produce PR-worthy changes without more information, credentials, approval, or an upstream fix."
    },
    "summary": {
      "type": "string",
      "minLength": 1,
      "pattern": "\\S",
      "description": "Short implementation summary for the source issue or task."
    },
    "notes": {
      "type": "string",
      "description": "Verification run or skipped, residual risk, reviewer notes, and fallback evidence when relevant. Partial results must provide non-empty Completed scope:, Incomplete scope:, Verification:, and Residual risk: labeled sections."
    },
    "blockedReason": {
      "type": "string",
      "description": "Reason the builder could not complete the task when status is blocked."
    },
    "humanRequest": {
      "type": "object",
      "additionalProperties": false,
      "required": ["reasonCode", "requestKey", "question"],
      "description": "A concrete unanswered human question. Include only when status is blocked and work cannot continue without the answer or approval.",
      "properties": {
        "reasonCode": {
          "type": "string",
          "enum": [
            "missing_information",
            "credentials",
            "billing",
            "destructive_action",
            "production_change",
            "policy_exception",
            "external_repository_action",
            "other_approval"
          ]
        },
        "requestKey": {
          "type": "string",
          "pattern": "^[a-z0-9][a-z0-9._:-]*$",
          "description": "Stable semantic identity for the requested decision. Keep it unchanged when only question wording changes."
        },
        "question": {
          "type": "string",
          "minLength": 1,
          "pattern": "\\S"
        }
      }
    },
    "discoveredIssues": {
      "type": "array",
      "description": "Bugs or follow-up issues found while implementing this task. The orchestrator, not Builder Agent, may file these as GitHub issues.",
      "items": {
        "type": "object",
        "additionalProperties": false,
        "required": ["title", "expected", "evidence"],
        "properties": {
          "title": {
            "type": "string",
            "minLength": 1,
            "pattern": "\\S"
          },
          "body": {
            "type": "string",
            "minLength": 1,
            "pattern": "\\S"
          },
          "expected": {
            "type": "string",
            "minLength": 1,
            "pattern": "\\S"
          },
          "evidence": {
            "type": "string",
            "minLength": 1,
            "pattern": "\\S"
          },
          "repo": {
            "type": "string",
            "minLength": 1,
            "pattern": "\\S",
            "description": "Optional target repository or Kaizen component alias such as kaizen-loop, builder-agent, verifier, or .github."
          },
          "severity": {
            "type": "string",
            "minLength": 1,
            "pattern": "\\S"
          },
          "labels": {
            "type": "array",
            "items": {
              "type": "string",
              "minLength": 1,
              "pattern": "\\S"
            }
          }
        }
      }
    }
  }
}
